"book_name", "chapter_number", "chunk_list_id", "original_text_chunk", "original_text_chunk_char_count","summary_chunk","summary_text_chunk_char_count"
Sherlock Homes,4,7,"['beautiful Stroud Valley, and over the broad gleaming Severn, found ourselves atthe pretty little country-town of Ross. A lean, ferret-like man, furtive andsly-looking, was waiting for us upon the platform. In spite of the light browndustcoat and leather-leggings which he wore in deference to his rusticsurroundings, I had no difficulty in recognising Lestrade, of Scotland Yard.With him we drove to the Hereford Arms where a room had already been engagedfor us. “I have ordered a carriage,” said Lestrade as we sat over a cup oftea. “I knew your energetic nature, and that you would not be happy untilyou had been on the scene of the crime.” “It was very nice and complimentary of you,” Holmes answered.“It is entirely a question of barometric pressure.” Lestrade looked startled. “I do not quite follow,” he said. “How is the glass? Twenty-nine, I see. No wind, and not a cloud in thesky. I have a caseful of cigarettes here which need smoking, and the sofa isvery much superior to the usual country hotel abomination. I do not think thatit is probable that I shall use the carriage to-night.” Lestrade laughed indulgently. “You have, no doubt, already formed yourconclusions from the newspapers,” he said. “The case is as plain asa pikestaff, and the more one goes into it the plainer it becomes. Still, ofcourse, one can’t refuse a lady, and such a very positive one, too. Shehas heard of you, and would have your opinion, though I repeatedly told herthat there was nothing which you could do which I had not already done. Why,bless my soul! here is her carriage at the door.” He had hardly spoken before there rushed into the room one of the most lovelyyoung women that I have ever seen in my life. Her violet eyes shining, her lipsparted, a pink flush upon her cheeks, all thought of her natural reserve lostin her overpowering excitement and concern. “Oh, Mr. Sherlock Holmes!” she cried, glancing from one to theother of us, and finally, with a woman’s quick intuition, fastening uponmy companion, “I am so glad that you have come. I have driven down totell you so. I know that James didn’t do it. I know it, and I want you tostart upon your work knowing it, too. Never let yourself doubt upon that point.We have known each other since we were little children, and I know his faultsas no one else does; but he is too tender-hearted to hurt a fly. Such a chargeis absurd to anyone who really knows him.” “I hope we may clear him, Miss Turner,” said Sherlock Holmes.“You may rely upon my doing all that I can.” “But you have read the evidence. You have formed some conclusion? Do younot see some loophole, some flaw? Do you not yourself think that he isinnocent?” “I think that it is very probable.” “There, now!” she cried, throwing back her head and lookingdefiantly at Lestrade. “You hear! He gives me hopes.” Lestrade shrugged his shoulders. “I am afraid that my colleague has been']",2891,"Sherlock Holmes and his companion arrive at the town of Ross, where they are met by Lestrade from Scotland Yard. Upon settling at the Hereford Arms hotel, Lestrade informs Holmes of a crime scene but Holmes, preferring to relax, hints he may not investigate immediately. Lestrade asserts the crime is straightforward, but a lady insists on Holmes' opinion. The lady, Miss Turner, bursts into the room and implores Holmes to help, insisting the accused, James, is innocent. Holmes reassures her he'll do his best and suggests that the likelihood of James' innocence is high. This prompts a defiant reaction from Miss Turner aimed at Lestrade, who shrugs, indicating his skepticism of Holmes' initial assessment.",710
Sherlock Homes,4,8,"['a little quick in forming his conclusions,” he said. “But he is right. Oh! I know that he is right. James never did it. Andabout his quarrel with his father, I am sure that the reason why he would notspeak about it to the coroner was because I was concerned in it.” “In what way?” asked Holmes. “It is no time for me to hide anything. James and his father had manydisagreements about me. Mr. McCarthy was very anxious that there should be amarriage between us. James and I have always loved each other as brother andsister; but of course he is young and has seen very little of life yet,and—and—well, he naturally did not wish to do anything like thatyet. So there were quarrels, and this, I am sure, was one of them.” “And your father?” asked Holmes. “Was he in favour of such aunion?” “No, he was averse to it also. No one but Mr. McCarthy was in favour ofit.” A quick blush passed over her fresh young face as Holmes shot one ofhis keen, questioning glances at her. “Thank you for this information,” said he. “May I see yourfather if I call to-morrow?” “I am afraid the doctor won’t allow it.” “The doctor?” “Yes, have you not heard? Poor father has never been strong for yearsback, but this has broken him down completely. He has taken to his bed, and Dr.Willows says that he is a wreck and that his nervous system is shattered. Mr.McCarthy was the only man alive who had known dad in the old days inVictoria.” “Ha! In Victoria! That is important.” “Yes, at the mines.” “Quite so; at the gold-mines, where, as I understand, Mr. Turner made hismoney.” “Yes, certainly.” “Thank you, Miss Turner. You have been of material assistance tome.” “You will tell me if you have any news to-morrow. No doubt you will go tothe prison to see James. Oh, if you do, Mr. Holmes, do tell him that I know himto be innocent.” “I will, Miss Turner.” “I must go home now, for dad is very ill, and he misses me so if I leavehim. Good-bye, and God help you in your undertaking.” She hurried fromthe room as impulsively as she had entered, and we heard the wheels of hercarriage rattle off down the street. “I am ashamed of you, Holmes,” said Lestrade with dignity after afew minutes’ silence. “Why should you raise up hopes which you arebound to disappoint? I am not over-tender of heart, but I call it cruel.” “I think that I see my way to clearing James McCarthy,” saidHolmes. “Have you an order to see him in prison?” “Yes, but only for you and me.” “Then I shall reconsider my resolution about going out. We have stilltime to take a train to Hereford and see him to-night?” “Ample.” “Then let us do so. Watson, I fear that you will find it very slow, but Ishall only be away a couple of hours.” I walked down to the station with them, and then wandered through the streetsof the little town, finally returning to the hotel, where I lay upon the sofaand tried to interest myself in a yellow-backed novel. The puny plot of the']",2909,"In the conversation, a girl reveals to Sherlock Holmes and Inspector Lestrade that James McCarthy never committed any crimes, despite allegations. She shares that the disagreements between James and his father were often because of her, as Mr. McCarthy wanted her to marry James. However, James and she viewed each other as siblings, and James was not ready to marry. The criminal accusations have made her father very ill, and she requests Holmes to inform James of her faith in his innocence. After she leaves, Lestrade criticizes Holmes for providing false hope, but Holmes feels confident about clearing James' name. They agree to see James in prison. Holmes warns Watson about the slow pace of investigation, leaving him to wait while he and Lestrade go meet James.",770
Sherlock Homes,4,9,"['story was so thin, however, when compared to the deep mystery through which wewere groping, and I found my attention wander so continually from the action tothe fact, that I at last flung it across the room and gave myself up entirelyto a consideration of the events of the day. Supposing that this unhappy youngman’s story were absolutely true, then what hellish thing, whatabsolutely unforeseen and extraordinary calamity could have occurred betweenthe time when he parted from his father, and the moment when, drawn back by hisscreams, he rushed into the glade? It was something terrible and deadly. Whatcould it be? Might not the nature of the injuries reveal something to mymedical instincts? I rang the bell and called for the weekly county paper,which contained a verbatim account of the inquest. In the surgeon’sdeposition it was stated that the posterior third of the left parietal bone andthe left half of the occipital bone had been shattered by a heavy blow from ablunt weapon. I marked the spot upon my own head. Clearly such a blow must havebeen struck from behind. That was to some extent in favour of the accused, aswhen seen quarrelling he was face to face with his father. Still, it did not gofor very much, for the older man might have turned his back before the blowfell. Still, it might be worth while to call Holmes’ attention to it.Then there was the peculiar dying reference to a rat. What could that mean? Itcould not be delirium. A man dying from a sudden blow does not commonly becomedelirious. No, it was more likely to be an attempt to explain how he met hisfate. But what could it indicate? I cudgelled my brains to find some possibleexplanation. And then the incident of the grey cloth seen by young McCarthy. Ifthat were true the murderer must have dropped some part of his dress,presumably his overcoat, in his flight, and must have had the hardihood toreturn and to carry it away at the instant when the son was kneeling with hisback turned not a dozen paces off. What a tissue of mysteries andimprobabilities the whole thing was! I did not wonder at Lestrade’sopinion, and yet I had so much faith in Sherlock Holmes’ insight that Icould not lose hope as long as every fresh fact seemed to strengthen hisconviction of young McCarthy’s innocence. It was late before Sherlock Holmes returned. He came back alone, for Lestradewas staying in lodgings in the town. “The glass still keeps very high,” he remarked as he sat down.“It is of importance that it should not rain before we are able to goover the ground. On the other hand, a man should be at his very best andkeenest for such nice work as that, and I did not wish to do it when fagged bya long journey. I have seen young McCarthy.” “And what did you learn from him?” “Nothing.” “Could he throw no light?” “None at all. I was inclined to think at one time that he knew who haddone it and was screening him or her, but I am convinced now that he is as']",2937,"The narrator is troubled by a murder case involving a young man, McCarthy, who is accused of killing his father. The father was found dead from a blow to the head, yet the circumstances are suspicious. Despite witnessing an argument between the two, evidence somewhat supports McCarthy's innocence. The mysterious mention of a ""rat"" by the dying man and a piece of grey cloth found at the scene add to the confusion. The narrator, insinuating he is a Sherlock Holmes' associate, is mystified but remains hopeful of McCarthy's innocence due to Holmes' conviction. The story ends with Sherlock returning from visiting the young McCarthy and revealing that the young man could not provide any insight into the case.",712
Sherlock Homes,4,10,"['puzzled as everyone else. He is not a very quick-witted youth, though comely tolook at and, I should think, sound at heart.” “I cannot admire his taste,” I remarked, “if it is indeed afact that he was averse to a marriage with so charming a young lady as thisMiss Turner.” “Ah, thereby hangs a rather painful tale. This fellow is madly, insanely,in love with her, but some two years ago, when he was only a lad, and before hereally knew her, for she had been away five years at a boarding-school, whatdoes the idiot do but get into the clutches of a barmaid in Bristol and marryher at a registry office? No one knows a word of the matter, but you canimagine how maddening it must be to him to be upbraided for not doing what hewould give his very eyes to do, but what he knows to be absolutely impossible.It was sheer frenzy of this sort which made him throw his hands up into the airwhen his father, at their last interview, was goading him on to propose to MissTurner. On the other hand, he had no means of supporting himself, and hisfather, who was by all accounts a very hard man, would have thrown him overutterly had he known the truth. It was with his barmaid wife that he had spentthe last three days in Bristol, and his father did not know where he was. Markthat point. It is of importance. Good has come out of evil, however, for thebarmaid, finding from the papers that he is in serious trouble and likely to behanged, has thrown him over utterly and has written to him to say that she hasa husband already in the Bermuda Dockyard, so that there is really no tiebetween them. I think that that bit of news has consoled young McCarthy for allthat he has suffered.” “But if he is innocent, who has done it?” “Ah! who? I would call your attention very particularly to two points.One is that the murdered man had an appointment with someone at the pool, andthat the someone could not have been his son, for his son was away, and he didnot know when he would return. The second is that the murdered man was heard tocry ‘Cooee!’ before he knew that his son had returned. Those arethe crucial points upon which the case depends. And now let us talk aboutGeorge Meredith, if you please, and we shall leave all minor matters untilto-morrow.” There was no rain, as Holmes had foretold, and the morning broke bright andcloudless. At nine o’clock Lestrade called for us with the carriage, andwe set off for Hatherley Farm and the Boscombe Pool. “There is serious news this morning,” Lestrade observed. “Itis said that Mr. Turner, of the Hall, is so ill that his life is despairedof.” “An elderly man, I presume?” said Holmes. “About sixty; but his constitution has been shattered by his life abroad,and he has been in failing health for some time. This business has had a verybad effect upon him. He was an old friend of McCarthy’s, and, I may add,a great benefactor to him, for I have learned that he gave him Hatherley Farmrent free.”']",2935,"The story revolves around a youth madly in love with Miss Turner. However, two years ago, unknowingly and without the knowledge of anyone else, he married a barmaid in Bristol, making his current love unattainable. The protagonist's father pushes him to propose to Miss Turner, which only torments him more as he cannot fulfill his father's wish due to his secret marriage. He has been staying with his barmaid wife in Bristol, and his father is unaware of his whereabouts. The situation takes a turn when the barmaid abandons him upon learning about his legal troubles. It comes to light that she already has a husband, implying there's no legal bond between her and the protagonist. The protagonist's father is critically ill and it's revealed he is a benefactor of McCarthy, having let him live on Hatherley Farm rent-free. Key clues are pointed out in a murder case, hinting that the son of the murdered man could not have been the one responsible for his death.",966
Sherlock Homes,4,11,"['rent free.” “Indeed! That is interesting,” said Holmes. “Oh, yes! In a hundred other ways he has helped him. Everybody about herespeaks of his kindness to him.” “Really! Does it not strike you as a little singular that this McCarthy,who appears to have had little of his own, and to have been under suchobligations to Turner, should still talk of marrying his son to Turner’sdaughter, who is, presumably, heiress to the estate, and that in such a verycocksure manner, as if it were merely a case of a proposal and all else wouldfollow? It is the more strange, since we know that Turner himself was averse tothe idea. The daughter told us as much. Do you not deduce something fromthat?” “We have got to the deductions and the inferences,” said Lestrade,winking at me. “I find it hard enough to tackle facts, Holmes, withoutflying away after theories and fancies.” “You are right,” said Holmes demurely; “you do find it veryhard to tackle the facts.” “Anyhow, I have grasped one fact which you seem to find it difficult toget hold of,” replied Lestrade with some warmth. “And that is—” “That McCarthy senior met his death from McCarthy junior and that alltheories to the contrary are the merest moonshine.” “Well, moonshine is a brighter thing than fog,” said Holmes,laughing. “But I am very much mistaken if this is not Hatherley Farm uponthe left.” “Yes, that is it.” It was a widespread, comfortable-lookingbuilding, two-storied, slate-roofed, with great yellow blotches of lichen uponthe grey walls. The drawn blinds and the smokeless chimneys, however, gave it astricken look, as though the weight of this horror still lay heavy upon it. Wecalled at the door, when the maid, at Holmes’ request, showed us theboots which her master wore at the time of his death, and also a pair of theson’s, though not the pair which he had then had. Having measured thesevery carefully from seven or eight different points, Holmes desired to be ledto the court-yard, from which we all followed the winding track which led toBoscombe Pool. Sherlock Holmes was transformed when he was hot upon such a scent as this. Menwho had only known the quiet thinker and logician of Baker Street would havefailed to recognise him. His face flushed and darkened. His brows were drawninto two hard black lines, while his eyes shone out from beneath them with asteely glitter. His face was bent downward, his shoulders bowed, his lipscompressed, and the veins stood out like whipcord in his long, sinewy neck. Hisnostrils seemed to dilate with a purely animal lust for the chase, and his mindwas so absolutely concentrated upon the matter before him that a question orremark fell unheeded upon his ears, or, at the most, only provoked a quick,impatient snarl in reply. Swiftly and silently he made his way along the trackwhich ran through the meadows, and so by way of the woods to the Boscombe Pool.']",2871,"Holmes and Lestrade discuss the peculiarity of McCarthy, a man of little means, discussing marriage plans for his son with Turner's daughter, an heiress. Turner himself is against the idea. Lestrade insists on the fact that the senior McCarthy was killed by his son, which Holmes dismisses as a mere theory. They arrive at Hatherley Farm, the crime scene and examine McCarthy's boots from the night of his death and a pair of his son's boots. Holmes is visibly excited during the investigation and is preoccupied with examining the evidence. His intense concentration and eagerness during the chase are emphasized. The boots measurements are taken before they head off towards Boscombe Pool.",691
Sherlock Homes,4,12,"['It was damp, marshy ground, as is all that district, and there were marks ofmany feet, both upon the path and amid the short grass which bounded it oneither side. Sometimes Holmes would hurry on, sometimes stop dead, and once hemade quite a little detour into the meadow. Lestrade and I walked behind him,the detective indifferent and contemptuous, while I watched my friend with theinterest which sprang from the conviction that every one of his actions wasdirected towards a definite end. The Boscombe Pool, which is a little reed-girt sheet of water some fifty yardsacross, is situated at the boundary between the Hatherley Farm and the privatepark of the wealthy Mr. Turner. Above the woods which lined it upon the fartherside we could see the red, jutting pinnacles which marked the site of the richlandowner’s dwelling. On the Hatherley side of the pool the woods grewvery thick, and there was a narrow belt of sodden grass twenty paces acrossbetween the edge of the trees and the reeds which lined the lake. Lestradeshowed us the exact spot at which the body had been found, and, indeed, somoist was the ground, that I could plainly see the traces which had been leftby the fall of the stricken man. To Holmes, as I could see by his eager faceand peering eyes, very many other things were to be read upon the trampledgrass. He ran round, like a dog who is picking up a scent, and then turned uponmy companion. “What did you go into the pool for?” he asked. “I fished about with a rake. I thought there might be some weapon orother trace. But how on earth—” “Oh, tut, tut! I have no time! That left foot of yours with its inwardtwist is all over the place. A mole could trace it, and there it vanishes amongthe reeds. Oh, how simple it would all have been had I been here before theycame like a herd of buffalo and wallowed all over it. Here is where the partywith the lodge-keeper came, and they have covered all tracks for six or eightfeet round the body. But here are three separate tracks of the samefeet.” He drew out a lens and lay down upon his waterproof to have abetter view, talking all the time rather to himself than to us. “Theseare young McCarthy’s feet. Twice he was walking, and once he ran swiftly,so that the soles are deeply marked and the heels hardly visible. That bearsout his story. He ran when he saw his father on the ground. Then here are thefather’s feet as he paced up and down. What is this, then? It is thebutt-end of the gun as the son stood listening. And this? Ha, ha! What have wehere? Tiptoes! tiptoes! Square, too, quite unusual boots! They come, they go,they come again—of course that was for the cloak. Now where did they comefrom?” He ran up and down, sometimes losing, sometimes finding the trackuntil we were well within the edge of the wood and under the shadow of a greatbeech, the largest tree in the neighbourhood. Holmes traced his way to the']",2894,"Sherlock Holmes, Dr. Watson, and detective Lestrade are examining the marshy area around Boscombe Pool, the crime scene, located between Hatherley Farm and the property of a rich landowner, Mr. Turner. Holmes investigates the various footprints around the area, suggesting that they belong to young McCarthy and his father, and an additional unknown person wearing unique boots. Holmes notes McCarthy ran at some point and his father paced up and down. He also spots the indent of a gun and traces of someone on tiptoes. Holmes continues his investigation towards a large beech tree in the woods.",596
