"book_name", "chapter_number", "chunk_list_id", "original_text_chunk", "original_text_chunk_char_count","summary_chunk","summary_text_chunk_char_count"
Sherlock Homes,4,13,"['farther side of this and lay down once more upon his face with a little cry ofsatisfaction. For a long time he remained there, turning over the leaves anddried sticks, gathering up what seemed to me to be dust into an envelope andexamining with his lens not only the ground but even the bark of the tree asfar as he could reach. A jagged stone was lying among the moss, and this alsohe carefully examined and retained. Then he followed a pathway through the wooduntil he came to the highroad, where all traces were lost. “It has been a case of considerable interest,” he remarked,returning to his natural manner. “I fancy that this grey house on theright must be the lodge. I think that I will go in and have a word with Moran,and perhaps write a little note. Having done that, we may drive back to ourluncheon. You may walk to the cab, and I shall be with you presently.” It was about ten minutes before we regained our cab and drove back into Ross,Holmes still carrying with him the stone which he had picked up in the wood. “This may interest you, Lestrade,” he remarked, holding it out.“The murder was done with it.” “I see no marks.” “There are none.” “How do you know, then?” “The grass was growing under it. It had only lain there a few days. Therewas no sign of a place whence it had been taken. It corresponds with theinjuries. There is no sign of any other weapon.” “And the murderer?” “Is a tall man, left-handed, limps with the right leg, wears thick-soledshooting-boots and a grey cloak, smokes Indian cigars, uses a cigar-holder, andcarries a blunt pen-knife in his pocket. There are several other indications,but these may be enough to aid us in our search.” Lestrade laughed. “I am afraid that I am still a sceptic,” he said.“Theories are all very well, but we have to deal with a hard-headedBritish jury.” “Nous verrons,” answered Holmes calmly. “You work yourown method, and I shall work mine. I shall be busy this afternoon, and shallprobably return to London by the evening train.” “And leave your case unfinished?” “No, finished.” “But the mystery?” “It is solved.” “Who was the criminal, then?” “The gentleman I describe.” “But who is he?” “Surely it would not be difficult to find out. This is not such apopulous neighbourhood.” Lestrade shrugged his shoulders. “I am a practical man,” he said,“and I really cannot undertake to go about the country looking for aleft-handed gentleman with a game leg. I should become the laughing-stock ofScotland Yard.” “All right,” said Holmes quietly. “I have given you thechance. Here are your lodgings. Good-bye. I shall drop you a line before Ileave.” Having left Lestrade at his rooms, we drove to our hotel, where we found lunchupon the table. Holmes was silent and buried in thought with a painedexpression upon his face, as one who finds himself in a perplexing position. “Look here, Watson,” he said when the cloth was cleared “just']",2899,"Sherlock Holmes is examining what seems to be the location of a crime scene. After collecting dust into an envelope, inspecting a jagged stone and nearby tree, he follows a pathway through the wood until the traces are lost at the highroad. He determines that a murder was committed with the jagged stone, despite the absence of visible marks on it. According to him, the murderer is left-handed, limps with the right leg, smokes Indian cigars, uses a cigar holder, and carries a blunt pen-knife. Despite Holmes's confidence in his theories, Lestrade, a practical man, expresses scepticism. Lestrade finds Holmes's description of the criminal too vague for identification and laughs off the idea of seeking such a specific figure. However, Holmes implies that he has already solved the mystery. They part ways, with Holmes warning Lestrade that he will send him a note before he leaves. Back at their hotel, Holmes is deep in thought, feeling somewhat perplexed.",962
Sherlock Homes,4,14,"['sit down in this chair and let me preach to you for a little. I don’tknow quite what to do, and I should value your advice. Light a cigar and let meexpound.”  “Pray do so.” “Well, now, in considering this case there are two points about youngMcCarthy’s narrative which struck us both instantly, although theyimpressed me in his favour and you against him. One was the fact that hisfather should, according to his account, cry ‘Cooee!’ before seeinghim. The other was his singular dying reference to a rat. He mumbled severalwords, you understand, but that was all that caught the son’s ear. Nowfrom this double point our research must commence, and we will begin it bypresuming that what the lad says is absolutely true.” “What of this ‘Cooee!’ then?” “Well, obviously it could not have been meant for the son. The son, asfar as he knew, was in Bristol. It was mere chance that he was within earshot.The ‘Cooee!’ was meant to attract the attention of whoever it wasthat he had the appointment with. But ‘Cooee’ is a distinctlyAustralian cry, and one which is used between Australians. There is a strongpresumption that the person whom McCarthy expected to meet him at Boscombe Poolwas someone who had been in Australia.” “What of the rat, then?” Sherlock Holmes took a folded paper from his pocket and flattened it out on thetable. “This is a map of the Colony of Victoria,” he said. “Iwired to Bristol for it last night.” He put his hand over part of themap. “What do you read?” “ARAT,” I read. “And now?” He raised his hand. “BALLARAT.” “Quite so. That was the word the man uttered, and of which his son onlycaught the last two syllables. He was trying to utter the name of his murderer.So and so, of Ballarat.” “It is wonderful!” I exclaimed. “It is obvious. And now, you see, I had narrowed the field downconsiderably. The possession of a grey garment was a third point which,granting the son’s statement to be correct, was a certainty. We have comenow out of mere vagueness to the definite conception of an Australian fromBallarat with a grey cloak.” “Certainly.” “And one who was at home in the district, for the pool can only beapproached by the farm or by the estate, where strangers could hardlywander.” “Quite so.” “Then comes our expedition of to-day. By an examination of the ground Igained the trifling details which I gave to that imbecile Lestrade, as to thepersonality of the criminal.” “But how did you gain them?” “You know my method. It is founded upon the observation oftrifles.” “His height I know that you might roughly judge from the length of hisstride. His boots, too, might be told from their traces.” “Yes, they were peculiar boots.” “But his lameness?” “The impression of his right foot was always less distinct than his left.He put less weight upon it. Why? Because he limped—he was lame.” “But his left-handedness.” “You were yourself struck by the nature of the injury as recorded by the']",2918,"The speaker seeks advice on a case involving the son of a murdered man, young McCarthy. Two points about McCarthy's narrative are the father's cry of 'Cooee!' before seeing his son, and his dying reference to a rat. The speaker argues that 'Cooee!', an Australian cry, suggests that McCarthy's father was meeting someone from Australia, presumably at Boscombe Pool where he was found dead. The reference to a rat, the speaker reveals, is a truncated cry of 'Ballarat', a place in Australia. The speaker believes that the murderer is an Australian from Ballarat wearing a grey cloak, who is familiar with the district. Through careful observation of the crime scene, the speaker also deduces that the murderer has a distinct stride, wears unique boots, limps, and is left-handed.",778
Sherlock Homes,4,15,"['surgeon at the inquest. The blow was struck from immediately behind, and yetwas upon the left side. Now, how can that be unless it were by a left-handedman? He had stood behind that tree during the interview between the father andson. He had even smoked there. I found the ash of a cigar, which my specialknowledge of tobacco ashes enables me to pronounce as an Indian cigar. I have,as you know, devoted some attention to this, and written a little monograph onthe ashes of 140 different varieties of pipe, cigar, and cigarette tobacco.Having found the ash, I then looked round and discovered the stump among themoss where he had tossed it. It was an Indian cigar, of the variety which arerolled in Rotterdam.” “And the cigar-holder?” “I could see that the end had not been in his mouth. Therefore he used aholder. The tip had been cut off, not bitten off, but the cut was not a cleanone, so I deduced a blunt pen-knife.” “Holmes,” I said, “you have drawn a net round this man fromwhich he cannot escape, and you have saved an innocent human life as truly asif you had cut the cord which was hanging him. I see the direction in which allthis points. The culprit is—” “Mr. John Turner,” cried the hotel waiter, opening the door of oursitting-room, and ushering in a visitor. The man who entered was a strange and impressive figure. His slow, limping stepand bowed shoulders gave the appearance of decrepitude, and yet his hard,deep-lined, craggy features, and his enormous limbs showed that he waspossessed of unusual strength of body and of character. His tangled beard,grizzled hair, and outstanding, drooping eyebrows combined to give an air ofdignity and power to his appearance, but his face was of an ashen white, whilehis lips and the corners of his nostrils were tinged with a shade of blue. Itwas clear to me at a glance that he was in the grip of some deadly and chronicdisease. “Pray sit down on the sofa,” said Holmes gently. “You had mynote?” “Yes, the lodge-keeper brought it up. You said that you wished to see mehere to avoid scandal.” “I thought people would talk if I went to the Hall.” “And why did you wish to see me?” He looked across at my companionwith despair in his weary eyes, as though his question was already answered. “Yes,” said Holmes, answering the look rather than the words.“It is so. I know all about McCarthy.” The old man sank his face in his hands. “God help me!” he cried.“But I would not have let the young man come to harm. I give you my wordthat I would have spoken out if it went against him at the Assizes.” “I am glad to hear you say so,” said Holmes gravely. “I would have spoken now had it not been for my dear girl. It would breakher heart—it will break her heart when she hears that I amarrested.” “It may not come to that,” said Holmes. “What?” “I am no official agent. I understand that it was your daughter who']",2862,"The narrative revolves around a crime scene investigation where a blow is found to have been struck from behind on the left side, indicating a left-handed person might be the culprit. The suspect had been standing behind a tree and evidence of his presence was an Indian cigar of a variety rolled in Rotterdam. A stump of the cigar suggested that he used a cigar-holder and cut the end off with a blunt pen-knife. An innocent life is saved due to this inquisition. The suspect is revealed to be a man named John Turner, a physically imposing but sick individual. Turner admits to having knowledge about the crime but swears he would not let an innocent man be blamed. Holmes reassures him that his arrest may not be inevitable as he is not an official agent. Turner's primary concern is the impact of the scandal on his daughter.",829
Sherlock Homes,4,16,"['required my presence here, and I am acting in her interests. Young McCarthymust be got off, however.” “I am a dying man,” said old Turner. “I have had diabetes foryears. My doctor says it is a question whether I shall live a month. Yet Iwould rather die under my own roof than in a gaol.” Holmes rose and sat down at the table with his pen in his hand and a bundle ofpaper before him. “Just tell us the truth,” he said. “I shalljot down the facts. You will sign it, and Watson here can witness it. Then Icould produce your confession at the last extremity to save young McCarthy. Ipromise you that I shall not use it unless it is absolutely needed.” “It’s as well,” said the old man; “it’s aquestion whether I shall live to the Assizes, so it matters little to me, but Ishould wish to spare Alice the shock. And now I will make the thing clear toyou; it has been a long time in the acting, but will not take me long to tell. “You didn’t know this dead man, McCarthy. He was a devil incarnate.I tell you that. God keep you out of the clutches of such a man as he. His griphas been upon me these twenty years, and he has blasted my life. I’lltell you first how I came to be in his power. “It was in the early ’60’s at the diggings. I was a youngchap then, hot-blooded and reckless, ready to turn my hand at anything; I gotamong bad companions, took to drink, had no luck with my claim, took to thebush, and in a word became what you would call over here a highway robber.There were six of us, and we had a wild, free life of it, sticking up a stationfrom time to time, or stopping the wagons on the road to the diggings. BlackJack of Ballarat was the name I went under, and our party is still rememberedin the colony as the Ballarat Gang. “One day a gold convoy came down from Ballarat to Melbourne, and we layin wait for it and attacked it. There were six troopers and six of us, so itwas a close thing, but we emptied four of their saddles at the first volley.Three of our boys were killed, however, before we got the swag. I put my pistolto the head of the wagon-driver, who was this very man McCarthy. I wish to theLord that I had shot him then, but I spared him, though I saw his wicked littleeyes fixed on my face, as though to remember every feature. We got away withthe gold, became wealthy men, and made our way over to England without beingsuspected. There I parted from my old pals and determined to settle down to aquiet and respectable life. I bought this estate, which chanced to be in themarket, and I set myself to do a little good with my money, to make up for theway in which I had earned it. I married, too, and though my wife died young sheleft me my dear little Alice. Even when she was just a baby her wee hand seemedto lead me down the right path as nothing else had ever done. In a word, Iturned over a new leaf and did my best to make up for the past. All was goingwell when McCarthy laid his grip upon me.']",2929,"The old man, Turner, is dying due to diabetes. He confesses to having a criminal past in the '60s where he was among a gang of robbers known as the Ballarat Gang. They became wealthy after a successful robbery targeting a gold convoy. The wagon-driver of that convoy was McCarthy, who Turner regrets not killing at the time as he has thwarted Turner's attempts at leading a peaceful life since then. Turner eventually separated from his gang, got married, and had a daughter. He bought an estate and tried to reform himself. Despite his efforts, McCarthy's presence remained a constant threat. Sherlock Holmes aims to use this confession as a last resort to secure freedom for the young McCarthy should the need arise.",719
Sherlock Homes,4,17,"['well when McCarthy laid his grip upon me. “I had gone up to town about an investment, and I met him in RegentStreet with hardly a coat to his back or a boot to his foot. “‘Here we are, Jack,’ says he, touching me on the arm;‘we’ll be as good as a family to you. There’s two of us, meand my son, and you can have the keeping of us. If youdon’t—it’s a fine, law-abiding country is England, andthere’s always a policeman within hail.’ “Well, down they came to the west country, there was no shaking them off,and there they have lived rent free on my best land ever since. There was norest for me, no peace, no forgetfulness; turn where I would, there was hiscunning, grinning face at my elbow. It grew worse as Alice grew up, for he soonsaw I was more afraid of her knowing my past than of the police. Whatever hewanted he must have, and whatever it was I gave him without question, land,money, houses, until at last he asked a thing which I could not give. He askedfor Alice. “His son, you see, had grown up, and so had my girl, and as I was knownto be in weak health, it seemed a fine stroke to him that his lad should stepinto the whole property. But there I was firm. I would not have his cursedstock mixed with mine; not that I had any dislike to the lad, but his blood wasin him, and that was enough. I stood firm. McCarthy threatened. I braved him todo his worst. We were to meet at the pool midway between our houses to talk itover. “When I went down there I found him talking with his son, so I smoked acigar and waited behind a tree until he should be alone. But as I listened tohis talk all that was black and bitter in me seemed to come uppermost. He wasurging his son to marry my daughter with as little regard for what she mightthink as if she were a slut from off the streets. It drove me mad to think thatI and all that I held most dear should be in the power of such a man as this.Could I not snap the bond? I was already a dying and a desperate man. Thoughclear of mind and fairly strong of limb, I knew that my own fate was sealed.But my memory and my girl! Both could be saved if I could but silence that foultongue. I did it, Mr. Holmes. I would do it again. Deeply as I have sinned, Ihave led a life of martyrdom to atone for it. But that my girl should beentangled in the same meshes which held me was more than I could suffer. Istruck him down with no more compunction than if he had been some foul andvenomous beast. His cry brought back his son; but I had gained the cover of thewood, though I was forced to go back to fetch the cloak which I had dropped inmy flight. That is the true story, gentlemen, of all that occurred.” “Well, it is not for me to judge you,” said Holmes as the old mansigned the statement which had been drawn out. “I pray that we may neverbe exposed to such a temptation.” “I pray not, sir. And what do you intend to do?” “In view of your health, nothing. You are yourself aware that you will']",2939,"The speaker has been blackmailed by a man named McCarthy and his son, who coerced him into providing for them. The man has been unable to escape their interference, particularly as McCarthy threatened to reveal his past to his daughter, Alice. McCarthy tried to arrange a marriage between his son and Alice, which enraged Alice's father due to his distrust of McCarthy and his desire to protect Alice. In a fit of anger and desperation, he killed McCarthy to protect his daughter and his own secret past. The speaker expresses no remorse for his actions, only relief. Holmes, however, refuses to pass judgment on the man, and implies he does not plan to take action against the man due to his frail health.",706
Sherlock Homes,4,18,"['soon have to answer for your deed at a higher court than the Assizes. I willkeep your confession, and if McCarthy is condemned I shall be forced to use it.If not, it shall never be seen by mortal eye; and your secret, whether you bealive or dead, shall be safe with us.” “Farewell, then,” said the old man solemnly. “Your owndeathbeds, when they come, will be the easier for the thought of the peacewhich you have given to mine.” Tottering and shaking in all his giantframe, he stumbled slowly from the room. “God help us!” said Holmes after a long silence. “Why doesfate play such tricks with poor, helpless worms? I never hear of such a case asthis that I do not think of Baxter’s words, and say, ‘There, butfor the grace of God, goes Sherlock Holmes.’” James McCarthy was acquitted at the Assizes on the strength of a number ofobjections which had been drawn out by Holmes and submitted to the defendingcounsel. Old Turner lived for seven months after our interview, but he is nowdead; and there is every prospect that the son and daughter may come to livehappily together in ignorance of the black cloud which rests upon their past.']",1136,"The speaker advises a man that he may need to justify his actions in a higher court. The speaker agrees to keep the man's confession and use it only if a certain McCarthy is found guilty. The older man expresses his gratitude and leaves. Sherlock Holmes, reflecting on the situation, laments about the cruel twists of fate. Thankfully, due to Holmes' efforts, James McCarthy is acquitted. The man who confessed lived for seven more months but has since died. His son and daughter may now live happily, unaware of the dark secret in their past.",543
