"book_name", "chapter_number", "chunk_list_id", "original_text_chunk", "original_text_chunk_char_count","summary_chunk","summary_text_chunk_char_count"
Sherlock Homes,4,1,"['We were seated atbreakfast one morning, my wife and I, when the maid brought in a telegram. Itwas from Sherlock Holmes and ran in this way: “Have you a couple of days to spare? Have just been wired for from thewest of England in connection with Boscombe Valley tragedy. Shall be glad ifyou will come with me. Air and scenery perfect. Leave Paddington by the11:15.” “What do you say, dear?” said my wife, looking across at me.“Will you go?” “I really don’t know what to say. I have a fairly long list atpresent.” “Oh, Anstruther would do your work for you. You have been looking alittle pale lately. I think that the change would do you good, and you arealways so interested in Mr. Sherlock Holmes’ cases.” “I should be ungrateful if I were not, seeing what I gained through oneof them,” I answered. “But if I am to go, I must pack at once, forI have only half an hour.” My experience of camp life in Afghanistan had at least had the effect of makingme a prompt and ready traveller. My wants were few and simple, so that in lessthan the time stated I was in a cab with my valise, rattling away to PaddingtonStation. Sherlock Holmes was pacing up and down the platform, his tall, gauntfigure made even gaunter and taller by his long grey travelling-cloak andclose-fitting cloth cap. “It is really very good of you to come, Watson,” said he. “Itmakes a considerable difference to me, having someone with me on whom I canthoroughly rely. Local aid is always either worthless or else biassed. If youwill keep the two corner seats I shall get the tickets.” We had the carriage to ourselves save for an immense litter of papers whichHolmes had brought with him. Among these he rummaged and read, with intervalsof note-taking and of meditation, until we were past Reading. Then he suddenlyrolled them all into a gigantic ball and tossed them up onto the rack. “Have you heard anything of the case?” he asked. “Not a word. I have not seen a paper for some days.” “The London press has not had very full accounts. I have just beenlooking through all the recent papers in order to master the particulars. Itseems, from what I gather, to be one of those simple cases which are soextremely difficult.” “That sounds a little paradoxical.” “But it is profoundly true. Singularity is almost invariably a clue. Themore featureless and commonplace a crime is, the more difficult it is to bringit home. In this case, however, they have established a very serious caseagainst the son of the murdered man.” “It is a murder, then?” “Well, it is conjectured to be so. I shall take nothing for granted untilI have the opportunity of looking personally into it. I will explain the stateof things to you, as far as I have been able to understand it, in a very fewwords. “Boscombe Valley is a country district not very far from Ross, inHerefordshire. The largest landed proprietor in that part is a Mr. John Turner,']",2888,"During breakfast, the narrator receives a telegram from Sherlock Holmes asking him to accompany him on a case involving the Boscombe Valley tragedy in the West of England. Despite a busy workload, he agrees due to persuasive words from his wife who points out his pallor and interest in Holmes' cases. After efficient packing, he soon meets Holmes at Paddington Station, who expresses gratitude for his company due to his reliability. They travel alone and Holmes fills him in on the case details; a murder in Boscombe Valley in Herefordshire. The main suspect is the son of the murdered man, a prominent landowner in the district. Holmes plans not to make any assumptions until he can investigate personally.",709
Sherlock Homes,4,2,"['who made his money in Australia and returned some years ago to the old country.One of the farms which he held, that of Hatherley, was let to Mr. CharlesMcCarthy, who was also an ex-Australian. The men had known each other in thecolonies, so that it was not unnatural that when they came to settle down theyshould do so as near each other as possible. Turner was apparently the richerman, so McCarthy became his tenant but still remained, it seems, upon terms ofperfect equality, as they were frequently together. McCarthy had one son, a ladof eighteen, and Turner had an only daughter of the same age, but neither ofthem had wives living. They appear to have avoided the society of theneighbouring English families and to have led retired lives, though both theMcCarthys were fond of sport and were frequently seen at the race-meetings ofthe neighbourhood. McCarthy kept two servants—a man and a girl. Turnerhad a considerable household, some half-dozen at the least. That is as much asI have been able to gather about the families. Now for the facts. “On June 3rd, that is, on Monday last, McCarthy left his house atHatherley about three in the afternoon and walked down to the Boscombe Pool,which is a small lake formed by the spreading out of the stream which runs downthe Boscombe Valley. He had been out with his serving-man in the morning atRoss, and he had told the man that he must hurry, as he had an appointment ofimportance to keep at three. From that appointment he never came back alive. “From Hatherley Farmhouse to the Boscombe Pool is a quarter of a mile,and two people saw him as he passed over this ground. One was an old woman,whose name is not mentioned, and the other was William Crowder, a game-keeperin the employ of Mr. Turner. Both these witnesses depose that Mr. McCarthy waswalking alone. The game-keeper adds that within a few minutes of his seeing Mr.McCarthy pass he had seen his son, Mr. James McCarthy, going the same way witha gun under his arm. To the best of his belief, the father was actually insight at the time, and the son was following him. He thought no more of thematter until he heard in the evening of the tragedy that had occurred. “The two McCarthys were seen after the time when William Crowder, thegame-keeper, lost sight of them. The Boscombe Pool is thickly wooded round,with just a fringe of grass and of reeds round the edge. A girl of fourteen,Patience Moran, who is the daughter of the lodge-keeper of the Boscombe Valleyestate, was in one of the woods picking flowers. She states that while she wasthere she saw, at the border of the wood and close by the lake, Mr. McCarthyand his son, and that they appeared to be having a violent quarrel. She heardMr. McCarthy the elder using very strong language to his son, and she saw thelatter raise up his hand as if to strike his father. She was so frightened bytheir violence that she ran away and told her mother when she reached home that']",2940,"Two ex-Australian men, Turner and McCarthy, settle on neighboring farms, Hatherley, in England after making their fortunes in Australia. Turner was wealthier, so McCarthy becomes his tenant. Both men are single fathers to an 18-year-old son and daughter respectively and they keep a low profile. McCarthy one day leaves his house for an appointment and is never seen alive again. Two witnesses, an unnamed old woman and a game-keeper, William Crowder, saw him walking alone, with his son, James McCarthy, following him with a gun. Another witness, a 14-year-old girl, reports seeing the McCarthys in a heated argument with the son appearing to threaten the father physically. The story surrounds the mystery of McCarthy's death.",728
Sherlock Homes,4,3,"['she had left the two McCarthys quarrelling near Boscombe Pool, and that she wasafraid that they were going to fight. She had hardly said the words when youngMr. McCarthy came running up to the lodge to say that he had found his fatherdead in the wood, and to ask for the help of the lodge-keeper. He was muchexcited, without either his gun or his hat, and his right hand and sleeve wereobserved to be stained with fresh blood. On following him they found the deadbody stretched out upon the grass beside the pool. The head had been beaten inby repeated blows of some heavy and blunt weapon. The injuries were such asmight very well have been inflicted by the butt-end of his son’s gun,which was found lying on the grass within a few paces of the body. Under thesecircumstances the young man was instantly arrested, and a verdict of‘wilful murder’ having been returned at the inquest on Tuesday, hewas on Wednesday brought before the magistrates at Ross, who have referred thecase to the next Assizes. Those are the main facts of the case as they came outbefore the coroner and the police-court.” “I could hardly imagine a more damning case,” I remarked. “Ifever circumstantial evidence pointed to a criminal it does so here.” “Circumstantial evidence is a very tricky thing,” answered Holmesthoughtfully. “It may seem to point very straight to one thing, but ifyou shift your own point of view a little, you may find it pointing in anequally uncompromising manner to something entirely different. It must beconfessed, however, that the case looks exceedingly grave against the youngman, and it is very possible that he is indeed the culprit. There are severalpeople in the neighbourhood, however, and among them Miss Turner, the daughterof the neighbouring landowner, who believe in his innocence, and who haveretained Lestrade, whom you may recollect in connection with the Study inScarlet, to work out the case in his interest. Lestrade, being rather puzzled,has referred the case to me, and hence it is that two middle-aged gentlemen areflying westward at fifty miles an hour instead of quietly digesting theirbreakfasts at home.” “I am afraid,” said I, “that the facts are so obvious thatyou will find little credit to be gained out of this case.” “There is nothing more deceptive than an obvious fact,” heanswered, laughing. “Besides, we may chance to hit upon some otherobvious facts which may have been by no means obvious to Mr. Lestrade. You knowme too well to think that I am boasting when I say that I shall either confirmor destroy his theory by means which he is quite incapable of employing, oreven of understanding. To take the first example to hand, I very clearlyperceive that in your bedroom the window is upon the right-hand side, and yet Iquestion whether Mr. Lestrade would have noted even so self-evident a thing asthat.” “How on earth—” “My dear fellow, I know you well. I know the military neatness which']",2928,"A woman had witnessed an argument between two McCarthys near Boscombe Pool. Shortly after, the son, McCarthy, rushed to a lodge claiming that his father was dead in the wood, asking for help. He was found to be covered in blood but had no gun or hat. The father's body was found nearby, beaten with a blunt weapon. Evidence suggested that the son's gun, found nearby, could have been the murder weapon, leading to the young McCarthy's arrest. At the inquest, a verdict of wilful murder was returned and he was put in front of the magistrates at Ross. However, some people, including Miss Turner, the daughter of a neighbouring landowner, believe in his innocence and have got a detective, Lestrade, involved. Lestrade, confused by the case, has asked for Holmes's assistance, leading the two men to travel westward to investigate the case. Despite the seemingly damning evidence against the son, Holmes notes that appearances can be deceiving and intends to either confirm or disprove Lestrade's theory using his unique investigation methods.",1042
Sherlock Homes,4,4,"['characterises you. You shave every morning, and in this season you shave by thesunlight; but since your shaving is less and less complete as we get fartherback on the left side, until it becomes positively slovenly as we get round theangle of the jaw, it is surely very clear that that side is less illuminatedthan the other. I could not imagine a man of your habits looking at himself inan equal light and being satisfied with such a result. I only quote this as atrivial example of observation and inference. Therein lies my métier,and it is just possible that it may be of some service in the investigationwhich lies before us. There are one or two minor points which were brought outin the inquest, and which are worth considering.” “What are they?” “It appears that his arrest did not take place at once, but after thereturn to Hatherley Farm. On the inspector of constabulary informing him thathe was a prisoner, he remarked that he was not surprised to hear it, and thatit was no more than his deserts. This observation of his had the natural effectof removing any traces of doubt which might have remained in the minds of thecoroner’s jury.” “It was a confession,” I ejaculated. “No, for it was followed by a protestation of innocence.” “Coming on the top of such a damning series of events, it was at least amost suspicious remark.” “On the contrary,” said Holmes, “it is the brightest riftwhich I can at present see in the clouds. However innocent he might be, hecould not be such an absolute imbecile as not to see that the circumstanceswere very black against him. Had he appeared surprised at his own arrest, orfeigned indignation at it, I should have looked upon it as highly suspicious,because such surprise or anger would not be natural under the circumstances,and yet might appear to be the best policy to a scheming man. His frankacceptance of the situation marks him as either an innocent man, or else as aman of considerable self-restraint and firmness. As to his remark about hisdeserts, it was also not unnatural if you consider that he stood beside thedead body of his father, and that there is no doubt that he had that very dayso far forgotten his filial duty as to bandy words with him, and even,according to the little girl whose evidence is so important, to raise his handas if to strike him. The self-reproach and contrition which are displayed inhis remark appear to me to be the signs of a healthy mind rather than of aguilty one.” I shook my head. “Many men have been hanged on far slighterevidence,” I remarked. “So they have. And many men have been wrongfully hanged.” “What is the young man’s own account of the matter?” “It is, I am afraid, not very encouraging to his supporters, though thereare one or two points in it which are suggestive. You will find it here, andmay read it for yourself.” He picked out from his bundle a copy of the local Herefordshire paper, and']",2906,"This passage from an unidentified text, likely a detective novel, describes a character's observations and deductions. The character first notices another's irregular shaving habits, showing their attention to detail and deductive reasoning. They bring up a point about the acceptance of one's arrest, suggesting that a person lacking surprise or indignation might be innocent or very self-controlled. Such acceptance would be suspicious to the observer had the arrested person showed feigned surprise or anger. The possible guilt of the arrested individual is also investigated, considering they were found near their deceased father. The narrator suggests that the person's contrite remarks might be signs of a healthy mind rather than a guilty one. The narrator also mentions that many men may have been wrongfully hung on lesser evidence. The arrested individual's account, however, doesn't seem very encouraging. Yet, there are some interesting points for consideration.",975
Sherlock Homes,4,5,"['having turned down the sheet he pointed out the paragraph in which theunfortunate young man had given his own statement of what had occurred. Isettled myself down in the corner of the carriage and read it very carefully.It ran in this way: “Mr. James McCarthy, the only son of the deceased, was then called andgave evidence as follows: ‘I had been away from home for three days atBristol, and had only just returned upon the morning of last Monday, the 3rd.My father was absent from home at the time of my arrival, and I was informed bythe maid that he had driven over to Ross with John Cobb, the groom. Shortlyafter my return I heard the wheels of his trap in the yard, and, looking out ofmy window, I saw him get out and walk rapidly out of the yard, though I was notaware in which direction he was going. I then took my gun and strolled out inthe direction of the Boscombe Pool, with the intention of visiting the rabbitwarren which is upon the other side. On my way I saw William Crowder, thegame-keeper, as he had stated in his evidence; but he is mistaken in thinkingthat I was following my father. I had no idea that he was in front of me. Whenabout a hundred yards from the pool I heard a cry of “Cooee!” whichwas a usual signal between my father and myself. I then hurried forward, andfound him standing by the pool. He appeared to be much surprised at seeing meand asked me rather roughly what I was doing there. A conversation ensued whichled to high words and almost to blows, for my father was a man of a veryviolent temper. Seeing that his passion was becoming ungovernable, I left himand returned towards Hatherley Farm. I had not gone more than 150 yards,however, when I heard a hideous outcry behind me, which caused me to run backagain. I found my father expiring upon the ground, with his head terriblyinjured. I dropped my gun and held him in my arms, but he almost instantlyexpired. I knelt beside him for some minutes, and then made my way to Mr.Turner’s lodge-keeper, his house being the nearest, to ask forassistance. I saw no one near my father when I returned, and I have no idea howhe came by his injuries. He was not a popular man, being somewhat cold andforbidding in his manners, but he had, as far as I know, no active enemies. Iknow nothing further of the matter.’ “The Coroner: Did your father make any statement to you before he died? “Witness: He mumbled a few words, but I could only catch some allusion toa rat. “The Coroner: What did you understand by that? “Witness: It conveyed no meaning to me. I thought that he was delirious. “The Coroner: What was the point upon which you and your father had thisfinal quarrel? “Witness: I should prefer not to answer. “The Coroner: I am afraid that I must press it. “Witness: It is really impossible for me to tell you. I can assure youthat it has nothing to do with the sad tragedy which followed.']",2877,"The summary of the passage is that James McCarthy recounts his experience on the day of his father's tragic death. After a short trip, he returned home and went out with his gun, heard his father's signal, and rushed to find him by the pool. They had an argument which almost ended up in a fight, but James walked away due to his father's violent temper. Shortly after, he heard a dreadful cry and returned to find his father dying of a severe head injury. He declares that he saw no one else around his father and didn't know how his father got his injuries. He also recounts that his father mumbled something about a rat before he died. The coroner presses James about the argument he had with his father before the tragedy, but James insists that it was irrelevant to the incident.",784
Sherlock Homes,4,6,"['“The Coroner: That is for the court to decide. I need not point out toyou that your refusal to answer will prejudice your case considerably in anyfuture proceedings which may arise. “Witness: I must still refuse. “The Coroner: I understand that the cry of ‘Cooee’ was acommon signal between you and your father? “Witness: It was. “The Coroner: How was it, then, that he uttered it before he saw you, andbefore he even knew that you had returned from Bristol? “Witness (with considerable confusion): I do not know. “A Juryman: Did you see nothing which aroused your suspicions when youreturned on hearing the cry and found your father fatally injured? “Witness: Nothing definite. “The Coroner: What do you mean? “Witness: I was so disturbed and excited as I rushed out into the open,that I could think of nothing except of my father. Yet I have a vagueimpression that as I ran forward something lay upon the ground to the left ofme. It seemed to me to be something grey in colour, a coat of some sort, or aplaid perhaps. When I rose from my father I looked round for it, but it wasgone. “‘Do you mean that it disappeared before you went forhelp?’ “‘Yes, it was gone.’ “  ‘You cannot say what it was?’ “‘No, I had a feeling something was there.’ “‘How far from the body?’ “‘A dozen yards or so.’ “‘And how far from the edge of the wood?’ “‘About the same.’ “‘Then if it was removed it was while you were within a dozenyards of it?’ “‘Yes, but with my back towards it.’ “This concluded the examination of the witness.” “I see,” said I as I glanced down the column, “that thecoroner in his concluding remarks was rather severe upon young McCarthy. Hecalls attention, and with reason, to the discrepancy about his father havingsignalled to him before seeing him, also to his refusal to give details of hisconversation with his father, and his singular account of his father’sdying words. They are all, as he remarks, very much against the son.” Holmes laughed softly to himself and stretched himself out upon the cushionedseat. “Both you and the coroner have been at some pains,” said he,“to single out the very strongest points in the young man’s favour.Don’t you see that you alternately give him credit for having too muchimagination and too little? Too little, if he could not invent a cause ofquarrel which would give him the sympathy of the jury; too much, if he evolvedfrom his own inner consciousness anything so outré as a dying referenceto a rat, and the incident of the vanishing cloth. No, sir, I shall approachthis case from the point of view that what this young man says is true, and weshall see whither that hypothesis will lead us. And now here is my pocketPetrarch, and not another word shall I say of this case until we are on thescene of action. We lunch at Swindon, and I see that we shall be there intwenty minutes.” It was nearly four o’clock when we at last, after passing through the']",2903,"The witness is being interrogated by the coroner about the death of his father. He explains the usual signal ('Cooee') between him and his father and admits to seeing a grey object near his father's body which vanished before he went for help. The coroner is suspicious of the witness's answers and inconsistencies, including his father's strange dying words and his refusal to answer some questions. Holmes, however, decides to approach the case from the perspective that the young man is telling the truth, stating that he will make no further judgments on the matter until they are on the scene. They plan to lunch at Swindon before arriving at the scene.",658
